{
  "$schema": "https://craft-birdeye.github.io/birdeye-business-context/schemas/account-bundle.schema.json",
  "schemaVersion": "1.0.0",
  "generatedAt": "2026-10-21T00:00:00Z",
  "account": {
    "id": "acct-pipewren-plumbing",
    "name": "Pipewren Plumbing & Drain",
    "brandName": "Pipewren Plumbing",
    "parentGroup": "Pipewren Trades",
    "segment": "ENT",
    "segmentLabel": "Enterprise",
    "industryId": "home-services",
    "industryLabel": "Home services and contractors",
    "tier": "Multi-market plumbing",
    "crm": "ServiceTitan",
    "purchasedLocations": 10,
    "isDefault": false,
    "quickScenario": false,
    "hq": {
      "city": "Phoenix",
      "state": "AZ",
      "stateName": "Arizona",
      "country": "United States"
    },
    "businessBlurb": "Phoenix-metro plumbing and drain group with 24/7 emergency dispatch.",
    "profile": {
      "description": "Phoenix-metro plumbing and drain group with 24/7 emergency dispatch. 24/7 plumbing across the Valley.",
      "categories": [
        "Plumber"
      ],
      "website": "https://pipewrenplumbing.example.com",
      "email": "hello@pipewrenplumbing.example.com",
      "phone": "(602) 555-0110",
      "primaryLocationId": "acct-pipewren-plumbing-loc-1",
      "address": {
        "street1": "6914 Brightwater Boulevard",
        "street2": "Suite 463",
        "city": "Phoenix",
        "state": "AZ",
        "stateName": "Arizona",
        "zip": "85044",
        "country": "US"
      }
    },
    "branding": {
      "brandName": "Pipewren Plumbing",
      "tagline": "24/7 plumbing across the Valley",
      "logo": {
        "kind": "monogram",
        "initials": "PP",
        "path": "v1/logos/acct-pipewren-plumbing.svg",
        "url": "https://craft-birdeye.github.io/birdeye-business-context/v1/logos/acct-pipewren-plumbing.svg"
      },
      "colors": {
        "primary": "#0077B6",
        "secondary": "#E6F4FB",
        "accent": "#F4A261",
        "onPrimary": "#FFFFFF"
      }
    },
    "tone": {
      "voice": "Fast, practical, and reassuring in emergencies.",
      "formality": "casual",
      "replySignoff": "Pipewren Plumbing & Drain"
    },
    "staff": [
      "Ruben",
      "Cody",
      "Marisa",
      "Hector"
    ],
    "services": [
      "a slab leak repair",
      "a drain clearing",
      "a water softener install",
      "a tankless water heater install"
    ],
    "llmContext": "Pipewren Plumbing & Drain · Enterprise · Home services and contractors · HQ Phoenix, Arizona, United States · 10 purchased locations · CRM ServiceTitan · Phoenix-metro plumbing and drain group with 24/7 emergency dispatch."
  },
  "locations": [
    {
      "id": "acct-pipewren-plumbing-loc-1",
      "accountId": "acct-pipewren-plumbing",
      "index": 1,
      "name": "Pipewren Plumbing - Phoenix Central",
      "shortName": "Phoenix Central",
      "label": "Pipewren Plumbing - Phoenix Central (Phoenix, AZ)",
      "locationLine": "Phoenix, AZ",
      "type": "Physical location",
      "status": "Active",
      "isHeadquarters": true,
      "address": {
        "street1": "6914 Brightwater Boulevard",
        "street2": "Suite 463",
        "city": "Phoenix",
        "state": "AZ",
        "stateName": "Arizona",
        "zip": "85044",
        "country": "US"
      },
      "phone": "(480) 555-0100",
      "email": "phoenix-central@pipewrenplumbing.example.com",
      "website": "https://pipewrenplumbing.example.com/locations/phoenix-central",
      "timezone": "America/Phoenix",
      "hours": [
        {
          "days": "Mon-Fri",
          "open": "07:00",
          "close": "19:00"
        },
        {
          "days": "Sat",
          "open": "08:00",
          "close": "16:00"
        },
        {
          "days": "Sun",
          "open": "emergency",
          "close": "emergency"
        }
      ],
      "owner": "Morgan Hale",
      "createdBy": "Morgan Hale",
      "createdOn": "2026-08-26T21:45:00Z"
    },
    {
      "id": "acct-pipewren-plumbing-loc-2",
      "accountId": "acct-pipewren-plumbing",
      "index": 2,
      "name": "Pipewren Plumbing - Mesa East",
      "shortName": "Mesa East",
      "label": "Pipewren Plumbing - Mesa East (Mesa, AZ)",
      "locationLine": "Mesa, AZ",
      "type": "Physical location",
      "status": "Active",
      "isHeadquarters": false,
      "address": {
        "street1": "5795 Elderberry Avenue",
        "street2": "Suite 416",
        "city": "Mesa",
        "state": "AZ",
        "stateName": "Arizona",
        "zip": "85205",
        "country": "US"
      },
      "phone": "(480) 555-0101",
      "email": "mesa-east@pipewrenplumbing.example.com",
      "website": "https://pipewrenplumbing.example.com/locations/mesa-east",
      "timezone": "America/Phoenix",
      "hours": [
        {
          "days": "Mon-Fri",
          "open": "07:00",
          "close": "19:00"
        },
        {
          "days": "Sat",
          "open": "08:00",
          "close": "16:00"
        },
        {
          "days": "Sun",
          "open": "emergency",
          "close": "emergency"
        }
      ],
      "owner": "Priya Nair",
      "createdBy": "Priya Nair",
      "createdOn": "2026-08-12T16:10:00Z"
    },
    {
      "id": "acct-pipewren-plumbing-loc-3",
      "accountId": "acct-pipewren-plumbing",
      "index": 3,
      "name": "Pipewren Plumbing - Scottsdale North",
      "shortName": "Scottsdale North",
      "label": "Pipewren Plumbing - Scottsdale North (Scottsdale, AZ)",
      "locationLine": "Scottsdale, AZ",
      "type": "Physical location",
      "status": "Active",
      "isHeadquarters": false,
      "address": {
        "street1": "4676 Dovetail Trail",
        "street2": "Suite 121",
        "city": "Scottsdale",
        "state": "AZ",
        "stateName": "Arizona",
        "zip": "85254",
        "country": "US"
      },
      "phone": "(480) 555-0102",
      "email": "scottsdale-north@pipewrenplumbing.example.com",
      "website": "https://pipewrenplumbing.example.com/locations/scottsdale-north",
      "timezone": "America/Phoenix",
      "hours": [
        {
          "days": "Mon-Fri",
          "open": "07:00",
          "close": "19:00"
        },
        {
          "days": "Sat",
          "open": "08:00",
          "close": "16:00"
        },
        {
          "days": "Sun",
          "open": "emergency",
          "close": "emergency"
        }
      ],
      "owner": "Jordan Blake",
      "createdBy": "Jordan Blake",
      "createdOn": "2026-07-29T19:35:00Z"
    },
    {
      "id": "acct-pipewren-plumbing-loc-4",
      "accountId": "acct-pipewren-plumbing",
      "index": 4,
      "name": "Pipewren Plumbing - Gilbert",
      "shortName": "Gilbert",
      "label": "Pipewren Plumbing - Gilbert (Gilbert, AZ)",
      "locationLine": "Gilbert, AZ",
      "type": "Physical location",
      "status": "Demo",
      "isHeadquarters": false,
      "address": {
        "street1": "3557 Goldfinch Row",
        "street2": "Suite 474",
        "city": "Gilbert",
        "state": "AZ",
        "stateName": "Arizona",
        "zip": "85296",
        "country": "US"
      },
      "phone": "(480) 555-0103",
      "email": "gilbert@pipewrenplumbing.example.com",
      "website": "https://pipewrenplumbing.example.com/locations/gilbert",
      "timezone": "America/Phoenix",
      "hours": [
        {
          "days": "Mon-Fri",
          "open": "07:00",
          "close": "19:00"
        },
        {
          "days": "Sat",
          "open": "08:00",
          "close": "16:00"
        },
        {
          "days": "Sun",
          "open": "emergency",
          "close": "emergency"
        }
      ],
      "owner": "Dana Whitfield",
      "createdBy": "Dana Whitfield",
      "createdOn": "2026-07-15T14:35:00Z"
    },
    {
      "id": "acct-pipewren-plumbing-loc-5",
      "accountId": "acct-pipewren-plumbing",
      "index": 5,
      "name": "Pipewren Plumbing - Chandler",
      "shortName": "Chandler",
      "label": "Pipewren Plumbing - Chandler (Chandler, AZ)",
      "locationLine": "Chandler, AZ",
      "type": "Physical location",
      "status": "Needs setup",
      "isHeadquarters": false,
      "address": {
        "street1": "2438 Falconridge Way",
        "street2": "",
        "city": "Chandler",
        "state": "AZ",
        "stateName": "Arizona",
        "zip": "85224",
        "country": "US"
      },
      "phone": "(480) 555-0104",
      "email": "chandler@pipewrenplumbing.example.com",
      "website": "https://pipewrenplumbing.example.com/locations/chandler",
      "timezone": "America/Phoenix",
      "hours": [
        {
          "days": "Mon-Fri",
          "open": "07:00",
          "close": "19:00"
        },
        {
          "days": "Sat",
          "open": "08:00",
          "close": "16:00"
        },
        {
          "days": "Sun",
          "open": "emergency",
          "close": "emergency"
        }
      ],
      "owner": "Rebecca Langston",
      "createdBy": "Rebecca Langston",
      "createdOn": "2026-07-01T17:00:00Z"
    },
    {
      "id": "acct-pipewren-plumbing-loc-6",
      "accountId": "acct-pipewren-plumbing",
      "index": 6,
      "name": "Pipewren Plumbing - Glendale West",
      "shortName": "Glendale West",
      "label": "Pipewren Plumbing - Glendale West (Glendale, AZ)",
      "locationLine": "Glendale, AZ",
      "type": "Physical location",
      "status": "Inactive",
      "isHeadquarters": false,
      "address": {
        "street1": "1319 Ironleaf Loop",
        "street2": "",
        "city": "Glendale",
        "state": "AZ",
        "stateName": "Arizona",
        "zip": "85308",
        "country": "US"
      },
      "phone": "(623) 555-0105",
      "email": "glendale-west@pipewrenplumbing.example.com",
      "website": "https://pipewrenplumbing.example.com/locations/glendale-west",
      "timezone": "America/Phoenix",
      "hours": [
        {
          "days": "Mon-Fri",